{
  "schemaVersion": 1,
  "platformID": "xiaohongshu-portrait",
  "displayName": "Xiaohongshu 4:5",
  "aspect": "portrait4x5",
  "sourceName": "Xiaohongshu creator guidance",
  "validatedAt": "2026-06-25",
  "regions": [
    { "id": "top-title", "kind": "occlusion", "points": [{ "x": 0, "y": 0 }, { "x": 1, "y": 0 }, { "x": 1, "y": 0.10 }, { "x": 0, "y": 0.10 }] },
    { "id": "caption-band", "kind": "occlusion", "points": [{ "x": 0.08, "y": 0.80 }, { "x": 0.92, "y": 0.80 }, { "x": 0.92, "y": 0.94 }, { "x": 0.08, "y": 0.94 }] },
    { "id": "right-actions", "kind": "occlusion", "points": [{ "x": 0.86, "y": 0.46 }, { "x": 0.97, "y": 0.46 }, { "x": 0.97, "y": 0.80 }, { "x": 0.86, "y": 0.80 }] }
  ]
}
