{
  "schemaVersion": 1,
  "platformID": "xiaohongshu-square",
  "displayName": "Xiaohongshu 1:1",
  "aspect": "square1x1",
  "sourceName": "Xiaohongshu creator guidance",
  "validatedAt": "2026-06-25",
  "regions": [
    { "id": "caption-band", "kind": "occlusion", "points": [{ "x": 0.08, "y": 0.78 }, { "x": 0.92, "y": 0.78 }, { "x": 0.92, "y": 0.94 }, { "x": 0.08, "y": 0.94 }] },
    { "id": "right-actions", "kind": "occlusion", "points": [{ "x": 0.86, "y": 0.42 }, { "x": 0.97, "y": 0.42 }, { "x": 0.97, "y": 0.78 }, { "x": 0.86, "y": 0.78 }] }
  ]
}
